No.,Time,Source,Destination,Protocol,Length,Info
1,12:09:58.390854384,144.38.239.87,172.64.41.4,TCP,54,51428  >  443 [ACK] Seq=1 Ack=1 Win=64256 Len=0
2,12:09:58.390869623,144.38.239.87,172.64.41.4,TCP,54,51416  >  443 [ACK] Seq=1 Ack=1 Win=64256 Len=0
3,12:09:58.412520287,172.64.41.4,144.38.239.87,TCP,54,443  >  51428 [ACK] Seq=1 Ack=675 Win=57344 Len=0
4,12:09:58.412520634,172.64.41.4,144.38.239.87,TCP,54,443  >  51416 [ACK] Seq=1 Ack=675 Win=57344 Len=0
5,12:09:58.422113414,144.38.239.87,172.64.41.4,TCP,54,51428  >  443 [ACK] Seq=675 Ack=4916 Win=59392 Len=0
6,12:09:58.422158207,144.38.239.87,172.64.41.4,TCP,54,51416  >  443 [ACK] Seq=675 Ack=4918 Win=59392 Len=0
7,12:09:58.469202328,172.64.41.4,144.38.239.87,TCP,54,443  >  51428 [ACK] Seq=4916 Ack=909 Win=65536 Len=0
8,12:09:58.469202517,172.64.41.4,144.38.239.87,TCP,54,443  >  51416 [ACK] Seq=4918 Ack=926 Win=65536 Len=0
9,12:09:58.470364312,144.38.239.87,172.64.41.4,TCP,54,"51416  >  443 [FIN, ACK] Seq=950 Ack=5455 Win=64128 Len=0"
10,12:09:58.474043531,144.38.239.87,172.64.41.4,TCP,54,51428  >  443 [ACK] Seq=1465 Ack=6622 Win=64128 Len=0
11,12:09:58.489700549,172.64.41.4,144.38.239.87,TCP,54,"443  >  51416 [FIN, ACK] Seq=5455 Ack=951 Win=65536 Len=0"
12,12:09:58.489729009,144.38.239.87,172.64.41.4,TCP,54,51416  >  443 [ACK] Seq=951 Ack=5456 Win=64128 Len=0
13,12:09:58.703563681,172.64.41.4,144.38.239.87,TCP,54,443  >  51428 [ACK] Seq=6622 Ack=1465 Win=65536 Len=0
14,12:09:58.865670792,144.38.239.87,34.107.221.82,TCP,54,55246  >  80 [ACK] Seq=1 Ack=1 Win=64256 Len=0
15,12:09:58.876269680,34.107.221.82,144.38.239.87,TCP,54,80  >  55246 [ACK] Seq=1 Ack=302 Win=66816 Len=0
16,12:09:58.880034288,144.38.239.87,34.107.221.82,TCP,54,55246  >  80 [ACK] Seq=302 Ack=299 Win=64128 Len=0
17,12:09:58.897856553,144.38.239.87,34.107.221.82,TCP,54,55252  >  80 [ACK] Seq=1 Ack=1 Win=64256 Len=0
18,12:09:58.910661785,34.107.221.82,144.38.239.87,TCP,54,80  >  55252 [ACK] Seq=1 Ack=304 Win=66816 Len=0
19,12:09:58.910684802,144.38.239.87,34.107.221.82,TCP,54,55252  >  80 [ACK] Seq=304 Ack=217 Win=64128 Len=0
20,12:09:58.936851164,144.38.239.87,172.64.41.4,TCP,54,51438  >  443 [ACK] Seq=1 Ack=1 Win=64256 Len=0
21,12:09:58.966007034,172.64.41.4,144.38.239.87,TCP,54,443  >  51438 [ACK] Seq=1 Ack=675 Win=57344 Len=0
22,12:09:58.966057375,144.38.239.87,172.64.41.4,TCP,54,51438  >  443 [ACK] Seq=675 Ack=4916 Win=59904 Len=0
23,12:09:58.980903040,144.38.239.87,172.64.41.4,TCP,54,51442  >  443 [ACK] Seq=1 Ack=1 Win=64256 Len=0
24,12:09:58.985381921,144.38.239.87,172.64.41.4,TCP,54,51452  >  443 [RST] Seq=1 Win=0 Len=0
25,12:09:58.985394692,144.38.239.87,172.64.41.4,TCP,54,51458  >  443 [RST] Seq=1 Win=0 Len=0
26,12:09:59.005374362,172.64.41.4,144.38.239.87,TCP,54,443  >  51438 [ACK] Seq=4916 Ack=909 Win=65536 Len=0
27,12:09:59.005374575,172.64.41.4,144.38.239.87,TCP,54,443  >  51442 [ACK] Seq=1 Ack=675 Win=57344 Len=0
28,12:09:59.005409593,144.38.239.87,172.64.41.4,TCP,54,51442  >  443 [ACK] Seq=675 Ack=4916 Win=59392 Len=0
29,12:09:59.009335492,144.38.239.87,172.64.41.4,TCP,54,51438  >  443 [ACK] Seq=1680 Ack=7176 Win=62464 Len=0
30,12:09:59.076729777,172.64.41.4,144.38.239.87,TCP,54,443  >  51442 [ACK] Seq=4916 Ack=926 Win=65536 Len=0
31,12:09:59.076730072,172.64.41.4,144.38.239.87,TCP,54,443  >  51438 [ACK] Seq=7176 Ack=1895 Win=65536 Len=0
32,12:09:59.077167809,144.38.239.87,172.64.41.4,TCP,54,51438  >  443 [ACK] Seq=2540 Ack=9392 Win=61952 Len=0
33,12:09:59.078933821,144.38.239.87,172.64.41.4,TCP,54,"51442  >  443 [FIN, ACK] Seq=950 Ack=5453 Win=64128 Len=0"
34,12:09:59.089286717,144.38.239.87,34.117.237.239,TCP,54,43110  >  443 [ACK] Seq=1 Ack=1 Win=64256 Len=0
35,12:09:59.089312337,144.38.239.87,34.117.237.239,TCP,54,43094  >  443 [ACK] Seq=1 Ack=1 Win=64256 Len=0
36,12:09:59.093895996,144.38.239.87,34.149.100.209,TCP,54,45980  >  443 [ACK] Seq=1 Ack=1 Win=64256 Len=0
37,12:09:59.098098823,172.64.41.4,144.38.239.87,TCP,54,443  >  51442 [ACK] Seq=5453 Ack=950 Win=57344 Len=0
38,12:09:59.098098862,172.64.41.4,144.38.239.87,TCP,54,"443  >  51442 [FIN, ACK] Seq=5453 Ack=951 Win=65536 Len=0"
39,12:09:59.098145157,144.38.239.87,172.64.41.4,TCP,54,51442  >  443 [ACK] Seq=951 Ack=5454 Win=64128 Len=0
40,12:09:59.101828962,34.117.237.239,144.38.239.87,TCP,54,443  >  43110 [ACK] Seq=1 Ack=677 Win=67072 Len=0
41,12:09:59.109937378,34.117.237.239,144.38.239.87,TCP,54,443  >  43094 [ACK] Seq=1 Ack=677 Win=67072 Len=0
42,12:09:59.109977229,144.38.239.87,34.117.237.239,TCP,54,43110  >  443 [ACK] Seq=677 Ack=3901 Win=60672 Len=0
43,12:09:59.109999568,144.38.239.87,34.117.237.239,TCP,54,43110  >  443 [ACK] Seq=677 Ack=4518 Win=60160 Len=0
44,12:09:59.110006335,144.38.239.87,34.117.237.239,TCP,54,43094  >  443 [ACK] Seq=677 Ack=3901 Win=60416 Len=0
45,12:09:59.110311574,144.38.239.87,34.117.237.239,TCP,54,43094  >  443 [ACK] Seq=677 Ack=4518 Win=59904 Len=0
46,12:09:59.121869241,34.149.100.209,144.38.239.87,TCP,54,443  >  45980 [ACK] Seq=1 Ack=686 Win=67072 Len=0
47,12:09:59.121897437,144.38.239.87,34.149.100.209,TCP,54,45980  >  443 [ACK] Seq=686 Ack=2601 Win=62336 Len=0
48,12:09:59.121910491,144.38.239.87,34.149.100.209,TCP,54,45980  >  443 [ACK] Seq=686 Ack=4554 Win=60416 Len=0
49,12:09:59.147452544,172.64.41.4,144.38.239.87,TCP,54,443  >  51438 [ACK] Seq=9392 Ack=2596 Win=57344 Len=0
50,12:09:59.147452838,172.64.41.4,144.38.239.87,TCP,54,443  >  51438 [ACK] Seq=9392 Ack=2755 Win=57344 Len=0
51,12:09:59.149065605,144.38.239.87,172.64.41.4,TCP,54,51438  >  443 [ACK] Seq=6896 Ack=11054 Win=64128 Len=0
52,12:09:59.163060021,144.38.239.87,34.160.144.191,TCP,54,41416  >  443 [ACK] Seq=1 Ack=1 Win=64256 Len=0
53,12:09:59.163004465,172.64.41.4,144.38.239.87,TCP,54,443  >  51438 [ACK] Seq=11054 Ack=3400 Win=65536 Len=0
54,12:09:59.163004503,172.64.41.4,144.38.239.87,TCP,54,443  >  51438 [ACK] Seq=11054 Ack=3886 Win=65536 Len=0
55,12:09:59.163960303,144.38.239.87,172.64.41.4,TCP,54,51438  >  443 [ACK] Seq=16945 Ack=12197 Win=64128 Len=0
56,12:09:59.167723588,144.38.239.87,172.64.41.4,TCP,54,51438  >  443 [ACK] Seq=18665 Ack=14413 Win=62080 Len=0
57,12:09:59.171603569,144.38.239.87,172.64.41.4,TCP,54,51438  >  443 [ACK] Seq=18665 Ack=16165 Win=60416 Len=0
58,12:09:59.171655569,144.38.239.87,172.64.41.4,TCP,54,51438  >  443 [ACK] Seq=18665 Ack=18381 Win=58240 Len=0
59,12:09:59.175920354,34.160.144.191,144.38.239.87,TCP,54,443  >  41416 [ACK] Seq=1 Ack=217 Win=66816 Len=0
60,12:09:59.175920396,172.64.41.4,144.38.239.87,TCP,54,443  >  51438 [ACK] Seq=20043 Ack=10495 Win=57344 Len=0
61,12:09:59.176135664,144.38.239.87,172.64.41.4,TCP,54,51438  >  443 [ACK] Seq=19095 Ack=20043 Win=64128 Len=0
62,12:09:59.179749191,144.38.239.87,34.160.144.191,TCP,54,41416  >  443 [ACK] Seq=217 Ack=2601 Win=63616 Len=0
63,12:09:59.179762194,144.38.239.87,34.160.144.191,TCP,54,41416  >  443 [ACK] Seq=217 Ack=4403 Win=61824 Len=0
64,12:09:59.186843786,172.64.41.4,144.38.239.87,TCP,54,443  >  51438 [ACK] Seq=20043 Ack=13095 Win=57344 Len=0
65,12:09:59.187186836,172.64.41.4,144.38.239.87,TCP,54,443  >  51438 [ACK] Seq=20043 Ack=15695 Win=57344 Len=0
66,12:09:59.187290054,144.38.239.87,172.64.41.4,TCP,54,51438  >  443 [ACK] Seq=19095 Ack=25243 Win=59648 Len=0
67,12:09:59.191325933,144.38.239.87,172.64.41.4,TCP,54,51438  >  443 [ACK] Seq=19095 Ack=27843 Win=61952 Len=0
68,12:09:59.191670699,144.38.239.87,172.64.41.4,TCP,54,51438  >  443 [ACK] Seq=19095 Ack=29960 Win=59904 Len=0
69,12:09:59.198848366,144.38.239.87,172.64.41.4,TCP,54,51438  >  443 [ACK] Seq=19095 Ack=31622 Win=61440 Len=0
70,12:09:59.199183721,144.38.239.87,172.64.41.4,TCP,54,51438  >  443 [ACK] Seq=19095 Ack=34392 Win=58752 Len=0
71,12:09:59.199414664,144.38.239.87,172.64.41.4,TCP,54,51438  >  443 [ACK] Seq=19095 Ack=36608 Win=56576 Len=0
72,12:09:59.199442001,144.38.239.87,172.64.41.4,TCP,54,51438  >  443 [ACK] Seq=19095 Ack=38824 Win=54400 Len=0
73,12:09:59.201206971,144.38.239.87,172.64.41.4,TCP,54,51438  >  443 [ACK] Seq=19095 Ack=39434 Win=64128 Len=0
74,12:09:59.203224815,144.38.239.87,172.64.41.4,TCP,54,51438  >  443 [ACK] Seq=19095 Ack=49995 Win=53632 Len=0
75,12:09:59.207350574,144.38.239.87,172.64.41.4,TCP,54,51438  >  443 [ACK] Seq=19095 Ack=51635 Win=57216 Len=0
76,12:09:59.240516661,144.38.239.87,34.160.144.191,TCP,54,41416  >  443 [ACK] Seq=310 Ack=4767 Win=64128 Len=0
77,12:09:59.246080578,144.38.239.87,23.44.229.236,TCP,54,53712  >  80 [ACK] Seq=1 Ack=1 Win=64256 Len=0
78,12:09:59.246088356,144.38.239.87,23.44.229.236,TCP,54,53728  >  80 [ACK] Seq=1 Ack=1 Win=64256 Len=0
79,12:09:59.246097032,144.38.239.87,23.44.229.236,TCP,54,53744  >  80 [ACK] Seq=1 Ack=1 Win=64256 Len=0
80,12:09:59.246103887,144.38.239.87,23.44.229.236,TCP,54,53700  >  80 [ACK] Seq=1 Ack=1 Win=64256 Len=0
81,12:09:59.253918449,144.38.239.87,172.64.41.4,TCP,54,51438  >  443 [ACK] Seq=19095 Ack=52189 Win=64128 Len=0
82,12:09:59.257605341,144.38.239.87,23.44.229.236,TCP,54,[TCP Dup ACK 307#1] 53728  >  80 [ACK] Seq=424 Ack=1 Win=64256 Len=0
83,12:09:59.257617930,144.38.239.87,23.44.229.236,TCP,54,[TCP Dup ACK 309#1] 53744  >  80 [ACK] Seq=424 Ack=1 Win=64256 Len=0
84,12:09:59.257621846,144.38.239.87,23.44.229.236,TCP,54,[TCP Dup ACK 305#1] 53712  >  80 [ACK] Seq=424 Ack=1 Win=64256 Len=0
85,12:09:59.257625277,144.38.239.87,23.44.229.236,TCP,54,[TCP Dup ACK 311#1] 53700  >  80 [ACK] Seq=424 Ack=1 Win=64256 Len=0
86,12:09:59.298271949,23.44.229.236,144.38.239.87,TCP,54,80  >  53728 [ACK] Seq=1 Ack=424 Win=64128 Len=0
87,12:09:59.298272058,23.44.229.236,144.38.239.87,TCP,54,80  >  53700 [ACK] Seq=1 Ack=424 Win=64128 Len=0
88,12:09:59.298272092,23.44.229.236,144.38.239.87,TCP,54,80  >  53712 [ACK] Seq=1 Ack=424 Win=64128 Len=0
89,12:09:59.298272126,23.44.229.236,144.38.239.87,TCP,54,80  >  53744 [ACK] Seq=1 Ack=424 Win=64128 Len=0
90,12:09:59.298311358,144.38.239.87,23.44.229.236,TCP,54,53700  >  80 [ACK] Seq=424 Ack=889 Win=64128 Len=0
91,12:09:59.298320823,144.38.239.87,23.44.229.236,TCP,54,53712  >  80 [ACK] Seq=424 Ack=890 Win=64128 Len=0
92,12:09:59.298325648,144.38.239.87,23.44.229.236,TCP,54,53728  >  80 [ACK] Seq=424 Ack=890 Win=64128 Len=0
93,12:09:59.298335141,144.38.239.87,23.44.229.236,TCP,54,53744  >  80 [ACK] Seq=424 Ack=890 Win=64128 Len=0
94,12:09:59.313709398,172.64.41.4,144.38.239.87,TCP,54,443  >  51438 [ACK] Seq=52189 Ack=19310 Win=65536 Len=0
95,12:09:59.318323983,144.38.239.87,172.64.41.4,TCP,54,51438  >  443 [ACK] Seq=19955 Ack=54405 Win=61952 Len=0
96,12:09:59.327272255,144.38.239.87,34.149.100.209,TCP,54,45980  >  443 [ACK] Seq=920 Ack=5140 Win=64128 Len=0
97,12:09:59.327293935,144.38.239.87,34.149.100.209,TCP,54,45980  >  443 [ACK] Seq=920 Ack=5171 Win=64128 Len=0
98,12:09:59.327311884,144.38.239.87,34.117.237.239,TCP,54,43094  >  443 [ACK] Seq=1098 Ack=5104 Win=64128 Len=0
99,12:09:59.327320272,144.38.239.87,34.117.237.239,TCP,54,43094  >  443 [ACK] Seq=1098 Ack=5135 Win=64128 Len=0
100,12:09:59.327327866,144.38.239.87,34.117.237.239,TCP,54,43110  >  443 [ACK] Seq=928 Ack=5104 Win=64128 Len=0
101,12:09:59.327335095,144.38.239.87,34.117.237.239,TCP,54,43110  >  443 [ACK] Seq=928 Ack=5135 Win=64128 Len=0
102,12:09:59.327342000,144.38.239.87,34.160.144.191,TCP,54,41416  >  443 [ACK] Seq=525 Ack=4805 Win=64128 Len=0
103,12:09:59.330008812,144.38.239.87,34.117.237.239,TCP,54,"43110  >  443 [FIN, ACK] Seq=952 Ack=5135 Win=64128 Len=0"
104,12:09:59.331574820,144.38.239.87,34.120.237.76,TCP,54,47824  >  443 [ACK] Seq=1 Ack=1 Win=64256 Len=0
105,12:09:59.331932700,144.38.239.87,34.120.237.76,TCP,54,47814  >  443 [ACK] Seq=1 Ack=1 Win=64256 Len=0
106,12:09:59.331938443,144.38.239.87,34.120.237.76,TCP,54,47858  >  443 [ACK] Seq=1 Ack=1 Win=64256 Len=0
107,12:09:59.331946514,144.38.239.87,34.120.237.76,TCP,54,47832  >  443 [ACK] Seq=1 Ack=1 Win=64256 Len=0
108,12:09:59.331953029,144.38.239.87,34.120.237.76,TCP,54,47830  >  443 [ACK] Seq=1 Ack=1 Win=64256 Len=0
109,12:09:59.331958655,144.38.239.87,34.120.237.76,TCP,54,47846  >  443 [ACK] Seq=1 Ack=1 Win=64256 Len=0
110,12:09:59.331926994,172.64.41.4,144.38.239.87,TCP,54,443  >  51428 [ACK] Seq=6622 Ack=1504 Win=57344 Len=0
111,12:09:59.331981031,144.38.239.87,172.64.41.4,TCP,54,51464  >  443 [ACK] Seq=1 Ack=1 Win=64256 Len=0
112,12:09:59.331992786,144.38.239.87,172.64.41.4,TCP,54,51470  >  443 [ACK] Seq=1 Ack=1 Win=64256 Len=0
113,12:09:59.336286872,172.64.41.4,144.38.239.87,TCP,54,"443  >  51428 [FIN, ACK] Seq=6622 Ack=1529 Win=65536 Len=0"
114,12:09:59.336306120,144.38.239.87,172.64.41.4,TCP,54,51428  >  443 [ACK] Seq=1529 Ack=6623 Win=64128 Len=0
115,12:09:59.336286983,34.117.237.239,144.38.239.87,TCP,54,443  >  43094 [ACK] Seq=5135 Ack=1098 Win=69632 Len=0
116,12:09:59.336287014,34.160.144.191,144.38.239.87,TCP,54,443  >  41416 [ACK] Seq=4805 Ack=525 Win=67840 Len=0
117,12:09:59.341147536,172.64.41.4,144.38.239.87,TCP,54,443  >  51438 [ACK] Seq=54405 Ack=20019 Win=65536 Len=0
118,12:09:59.341147608,172.64.41.4,144.38.239.87,TCP,54,"443  >  51438 [FIN, ACK] Seq=54405 Ack=20019 Win=65536 Len=0"
119,12:09:59.341178884,144.38.239.87,172.64.41.4,TCP,54,51438  >  443 [ACK] Seq=20019 Ack=54406 Win=64128 Len=0
120,12:09:59.341147644,34.117.237.239,144.38.239.87,TCP,54,443  >  43094 [ACK] Seq=5135 Ack=1129 Win=69632 Len=0
121,12:09:59.341147798,34.117.237.239,144.38.239.87,TCP,54,"443  >  43110 [FIN, ACK] Seq=5135 Ack=953 Win=68352 Len=0"
122,12:09:59.341191022,144.38.239.87,34.117.237.239,TCP,54,43110  >  443 [ACK] Seq=953 Ack=5136 Win=64128 Len=0
123,12:09:59.344985819,34.149.100.209,144.38.239.87,TCP,54,443  >  45980 [ACK] Seq=5171 Ack=951 Win=68352 Len=0
124,12:09:59.344985952,34.120.237.76,144.38.239.87,TCP,54,443  >  47824 [ACK] Seq=1 Ack=678 Win=67072 Len=0
125,12:09:59.349096698,144.38.239.87,34.120.237.76,TCP,54,47824  >  443 [ACK] Seq=678 Ack=2601 Win=62848 Len=0
126,12:09:59.349115994,144.38.239.87,34.120.237.76,TCP,54,47824  >  443 [ACK] Seq=678 Ack=4472 Win=61056 Len=0
127,12:09:59.349065932,34.120.237.76,144.38.239.87,TCP,54,443  >  47814 [ACK] Seq=1 Ack=678 Win=67072 Len=0
128,12:09:59.349065964,34.120.237.76,144.38.239.87,TCP,54,443  >  47858 [ACK] Seq=1 Ack=678 Win=67072 Len=0
129,12:09:59.349133185,144.38.239.87,34.120.237.76,TCP,54,47814  >  443 [ACK] Seq=678 Ack=2601 Win=62464 Len=0
130,12:09:59.349323426,144.38.239.87,34.120.237.76,TCP,54,47814  >  443 [ACK] Seq=678 Ack=4472 Win=60672 Len=0
131,12:09:59.349319956,34.120.237.76,144.38.239.87,TCP,54,443  >  47846 [ACK] Seq=1 Ack=678 Win=67072 Len=0
132,12:09:59.349341121,34.120.237.76,144.38.239.87,TCP,54,443  >  47832 [ACK] Seq=1 Ack=678 Win=67072 Len=0
133,12:09:59.353744737,144.38.239.87,34.120.237.76,TCP,54,47858  >  443 [ACK] Seq=678 Ack=2601 Win=62464 Len=0
134,12:09:59.353755372,144.38.239.87,34.120.237.76,TCP,54,47858  >  443 [ACK] Seq=678 Ack=4472 Win=60672 Len=0
135,12:09:59.353769235,144.38.239.87,34.149.100.209,TCP,54,45990  >  443 [ACK] Seq=1 Ack=1 Win=64256 Len=0
136,12:09:59.353724144,34.120.237.76,144.38.239.87,TCP,54,443  >  47830 [ACK] Seq=1 Ack=678 Win=67072 Len=0
137,12:09:59.353781040,144.38.239.87,34.120.237.76,TCP,54,47846  >  443 [ACK] Seq=678 Ack=2601 Win=62720 Len=0
138,12:09:59.353792018,144.38.239.87,34.120.237.76,TCP,54,47846  >  443 [ACK] Seq=678 Ack=4472 Win=60928 Len=0
139,12:09:59.353796166,144.38.239.87,34.120.237.76,TCP,54,47832  >  443 [ACK] Seq=678 Ack=2601 Win=63616 Len=0
140,12:09:59.353801753,144.38.239.87,34.120.237.76,TCP,54,47832  >  443 [ACK] Seq=678 Ack=4472 Win=61824 Len=0
141,12:09:59.353789290,172.64.41.4,144.38.239.87,TCP,54,443  >  51470 [ACK] Seq=1 Ack=1170 Win=57344 Len=0
142,12:09:59.353812597,144.38.239.87,172.64.41.4,TCP,54,51470  >  443 [ACK] Seq=1346 Ack=758 Win=64000 Len=0
143,12:09:59.353966274,144.38.239.87,172.64.41.4,TCP,54,51470  >  443 [ACK] Seq=1346 Ack=820 Win=64000 Len=0
144,12:09:59.353971562,144.38.239.87,34.120.237.76,TCP,54,47830  >  443 [ACK] Seq=678 Ack=1301 Win=64000 Len=0
145,12:09:59.358822687,144.38.239.87,34.120.237.76,TCP,54,47830  >  443 [ACK] Seq=678 Ack=2601 Win=63488 Len=0
146,12:09:59.358837255,144.38.239.87,34.120.237.76,TCP,54,47830  >  443 [ACK] Seq=678 Ack=4472 Win=61696 Len=0
147,12:09:59.358799899,172.64.41.4,144.38.239.87,TCP,54,443  >  51464 [ACK] Seq=1 Ack=1170 Win=57344 Len=0
148,12:09:59.358864914,144.38.239.87,172.64.41.4,TCP,54,51464  >  443 [ACK] Seq=1346 Ack=758 Win=64128 Len=0
149,12:09:59.358871693,144.38.239.87,172.64.41.4,TCP,54,51464  >  443 [ACK] Seq=1346 Ack=820 Win=64128 Len=0
150,12:09:59.358878437,144.38.239.87,172.64.41.4,TCP,54,51464  >  443 [ACK] Seq=1346 Ack=851 Win=64128 Len=0
151,12:09:59.362760534,144.38.239.87,34.117.237.239,TCP,54,43094  >  443 [ACK] Seq=1129 Ack=7091 Win=62208 Len=0
152,12:09:59.370608091,34.149.100.209,144.38.239.87,TCP,54,443  >  45990 [ACK] Seq=1 Ack=686 Win=67072 Len=0
153,12:09:59.375418051,144.38.239.87,34.149.100.209,TCP,54,45990  >  443 [ACK] Seq=686 Ack=2601 Win=63616 Len=0
154,12:09:59.375432393,144.38.239.87,34.149.100.209,TCP,54,45990  >  443 [ACK] Seq=686 Ack=4554 Win=61696 Len=0
155,12:09:59.375389663,172.64.41.4,144.38.239.87,TCP,54,443  >  51470 [ACK] Seq=851 Ack=1612 Win=65536 Len=0
156,12:09:59.379249741,23.44.229.236,144.38.239.87,TCP,54,80  >  53700 [ACK] Seq=889 Ack=847 Win=64128 Len=0
157,12:09:59.379249772,23.44.229.236,144.38.239.87,TCP,54,80  >  53744 [ACK] Seq=890 Ack=847 Win=64128 Len=0
158,12:09:59.379249870,34.117.237.239,144.38.239.87,TCP,54,443  >  43094 [ACK] Seq=7091 Ack=1168 Win=69632 Len=0
159,12:09:59.379303988,144.38.239.87,23.44.229.236,TCP,54,53744  >  80 [ACK] Seq=847 Ack=1779 Win=64128 Len=0
160,12:09:59.379334335,144.38.239.87,172.64.41.4,TCP,54,51470  >  443 [ACK] Seq=1986 Ack=2055 Win=62976 Len=0
161,12:09:59.379620156,144.38.239.87,23.44.229.236,TCP,54,53700  >  80 [ACK] Seq=847 Ack=1778 Win=64128 Len=0
162,12:09:59.379617019,172.64.41.4,144.38.239.87,TCP,54,443  >  51464 [ACK] Seq=851 Ack=1612 Win=65536 Len=0
163,12:09:59.383920502,144.38.239.87,172.64.41.4,TCP,54,51464  >  443 [ACK] Seq=2416 Ack=2664 Win=62336 Len=0
164,12:09:59.428547499,144.38.239.87,172.64.41.4,TCP,54,51464  >  443 [ACK] Seq=2416 Ack=3163 Win=64128 Len=0
165,12:09:59.474994828,144.38.239.87,34.120.237.76,TCP,54,47814  >  443 [ACK] Seq=1791 Ack=5058 Win=64128 Len=0
166,12:09:59.475013147,144.38.239.87,34.120.237.76,TCP,54,47824  >  443 [ACK] Seq=929 Ack=5058 Win=64128 Len=0
167,12:09:59.475030350,144.38.239.87,34.120.237.76,TCP,54,47814  >  443 [ACK] Seq=1791 Ack=5089 Win=64128 Len=0
168,12:09:59.475037636,144.38.239.87,34.120.237.76,TCP,54,47824  >  443 [ACK] Seq=929 Ack=5089 Win=64128 Len=0
169,12:09:59.476025120,144.38.239.87,34.120.237.76,TCP,54,"47824  >  443 [FIN, ACK] Seq=953 Ack=5089 Win=64128 Len=0"
170,12:09:59.479100786,144.38.239.87,34.120.237.76,TCP,54,47830  >  443 [ACK] Seq=929 Ack=5058 Win=64128 Len=0
171,12:09:59.479119113,144.38.239.87,34.120.237.76,TCP,54,47830  >  443 [ACK] Seq=929 Ack=5089 Win=64128 Len=0
172,12:09:59.479065946,23.44.229.236,144.38.239.87,TCP,54,80  >  53728 [ACK] Seq=890 Ack=847 Win=64128 Len=0
173,12:09:59.479131418,144.38.239.87,34.149.100.209,TCP,54,45990  >  443 [ACK] Seq=920 Ack=5140 Win=64128 Len=0
174,12:09:59.479149035,144.38.239.87,34.149.100.209,TCP,54,45990  >  443 [ACK] Seq=920 Ack=5171 Win=64128 Len=0
175,12:09:59.479157568,144.38.239.87,23.44.229.236,TCP,54,53728  >  80 [ACK] Seq=847 Ack=1779 Win=64128 Len=0
176,12:09:59.479066099,23.44.229.236,144.38.239.87,TCP,54,80  >  53712 [ACK] Seq=890 Ack=847 Win=64128 Len=0
177,12:09:59.479433124,23.44.229.236,144.38.239.87,TCP,54,80  >  53744 [ACK] Seq=1779 Ack=1270 Win=64128 Len=0
178,12:09:59.480069585,144.38.239.87,34.120.237.76,TCP,54,"47830  >  443 [FIN, ACK] Seq=953 Ack=5089 Win=64128 Len=0"
179,12:09:59.483835039,144.38.239.87,23.44.229.236,TCP,54,53744  >  80 [ACK] Seq=1270 Ack=2668 Win=64128 Len=0
180,12:09:59.483848326,144.38.239.87,23.44.229.236,TCP,54,53712  >  80 [ACK] Seq=847 Ack=1779 Win=64128 Len=0
181,12:09:59.487623027,34.120.237.76,144.38.239.87,TCP,54,"443  >  47824 [FIN, ACK] Seq=5089 Ack=954 Win=68352 Len=0"
182,12:09:59.487651684,144.38.239.87,34.120.237.76,TCP,54,47824  >  443 [ACK] Seq=954 Ack=5090 Win=64128 Len=0
183,12:09:59.492283054,172.64.41.4,144.38.239.87,TCP,54,443  >  51464 [ACK] Seq=3163 Ack=2631 Win=65536 Len=0
184,12:09:59.492283264,34.120.237.76,144.38.239.87,TCP,54,"443  >  47830 [FIN, ACK] Seq=5089 Ack=953 Win=68352 Len=0"
185,12:09:59.492319257,144.38.239.87,34.120.237.76,TCP,54,47830  >  443 [ACK] Seq=954 Ack=5090 Win=64128 Len=0
186,12:09:59.492283338,34.120.237.76,144.38.239.87,TCP,54,443  >  47830 [ACK] Seq=5090 Ack=954 Win=68352 Len=0
187,12:09:59.492283389,34.120.237.76,144.38.239.87,TCP,54,443  >  47814 [ACK] Seq=5412 Ack=1861 Win=71168 Len=0
188,12:09:59.492362928,144.38.239.87,172.64.41.4,TCP,54,51464  >  443 [ACK] Seq=2846 Ack=3218 Win=64128 Len=0
189,12:09:59.492378329,144.38.239.87,172.64.41.4,TCP,54,51464  >  443 [ACK] Seq=2846 Ack=3717 Win=64000 Len=0
190,12:09:59.496065522,144.38.239.87,172.64.41.4,TCP,54,51464  >  443 [ACK] Seq=2846 Ack=3772 Win=64128 Len=0
191,12:09:59.496078135,144.38.239.87,172.64.41.4,TCP,54,51464  >  443 [ACK] Seq=2846 Ack=4271 Win=64000 Len=0
192,12:09:59.496046261,34.149.100.209,144.38.239.87,TCP,54,443  >  45990 [ACK] Seq=5171 Ack=951 Win=68352 Len=0
193,12:09:59.500474420,144.38.239.87,34.120.237.76,TCP,54,47858  >  443 [ACK] Seq=929 Ack=5058 Win=64128 Len=0
194,12:09:59.500521250,144.38.239.87,34.120.237.76,TCP,54,47858  >  443 [ACK] Seq=929 Ack=5089 Win=64128 Len=0
195,12:09:59.500530967,144.38.239.87,34.120.237.76,TCP,54,47846  >  443 [ACK] Seq=929 Ack=5058 Win=64128 Len=0
196,12:09:59.500534817,144.38.239.87,34.120.237.76,TCP,54,47846  >  443 [ACK] Seq=929 Ack=5089 Win=64128 Len=0
197,12:09:59.500643247,144.38.239.87,34.120.237.76,TCP,54,47832  >  443 [ACK] Seq=929 Ack=5058 Win=64128 Len=0
198,12:09:59.500647929,144.38.239.87,34.120.237.76,TCP,54,47832  >  443 [ACK] Seq=929 Ack=5089 Win=64128 Len=0
199,12:09:59.501972001,144.38.239.87,34.120.237.76,TCP,54,"47832  >  443 [FIN, ACK] Seq=953 Ack=5089 Win=64128 Len=0"
200,12:09:59.502084566,144.38.239.87,34.120.237.76,TCP,54,"47846  >  443 [FIN, ACK] Seq=953 Ack=5089 Win=64128 Len=0"
201,12:09:59.502322699,144.38.239.87,34.120.237.76,TCP,54,"47858  >  443 [FIN, ACK] Seq=953 Ack=5089 Win=64128 Len=0"
202,12:09:59.512043632,34.120.237.76,144.38.239.87,TCP,54,"443  >  47832 [FIN, ACK] Seq=5089 Ack=954 Win=68352 Len=0"
203,12:09:59.512088123,144.38.239.87,34.120.237.76,TCP,54,47832  >  443 [ACK] Seq=954 Ack=5090 Win=64128 Len=0
204,12:09:59.512043920,34.120.237.76,144.38.239.87,TCP,54,"443  >  47846 [FIN, ACK] Seq=5089 Ack=954 Win=68352 Len=0"
205,12:09:59.512120052,144.38.239.87,34.120.237.76,TCP,54,47846  >  443 [ACK] Seq=954 Ack=5090 Win=64128 Len=0
206,12:09:59.512044002,34.120.237.76,144.38.239.87,TCP,54,"443  >  47858 [FIN, ACK] Seq=5089 Ack=954 Win=68352 Len=0"
207,12:09:59.512136399,144.38.239.87,34.120.237.76,TCP,54,47858  >  443 [ACK] Seq=954 Ack=5090 Win=64128 Len=0
208,12:09:59.519808174,34.120.237.76,144.38.239.87,TCP,54,443  >  47814 [ACK] Seq=5723 Ack=2576 Win=75264 Len=0
209,12:09:59.548523471,144.38.239.87,34.120.237.76,TCP,54,47814  >  443 [ACK] Seq=2576 Ack=5723 Win=64128 Len=0
210,12:09:59.805257048,172.64.41.4,144.38.239.87,TCP,54,443  >  51464 [ACK] Seq=4271 Ack=3061 Win=65536 Len=0
211,12:09:59.805353676,144.38.239.87,172.64.41.4,TCP,54,51464  >  443 [ACK] Seq=4351 Ack=4326 Win=64128 Len=0
212,12:09:59.805374449,144.38.239.87,172.64.41.4,TCP,54,51464  >  443 [ACK] Seq=4351 Ack=4825 Win=64000 Len=0
213,12:09:59.805382255,144.38.239.87,172.64.41.4,TCP,54,51464  >  443 [ACK] Seq=4351 Ack=4880 Win=64000 Len=0
214,12:09:59.805392662,144.38.239.87,172.64.41.4,TCP,54,51464  >  443 [ACK] Seq=4351 Ack=5379 Win=63616 Len=0
215,12:09:59.805399477,144.38.239.87,172.64.41.4,TCP,54,51464  >  443 [ACK] Seq=4351 Ack=5434 Win=63616 Len=0
216,12:09:59.805406186,144.38.239.87,172.64.41.4,TCP,54,51464  >  443 [ACK] Seq=4351 Ack=5933 Win=63232 Len=0
217,12:09:59.817523061,144.38.239.87,34.120.208.123,TCP,54,54588  >  443 [ACK] Seq=1 Ack=1 Win=64256 Len=0
218,12:09:59.817550857,144.38.239.87,34.120.208.123,TCP,54,54598  >  443 [ACK] Seq=1 Ack=1 Win=64256 Len=0
219,12:09:59.821358383,172.64.41.4,144.38.239.87,TCP,54,443  >  51464 [ACK] Seq=5933 Ack=3706 Win=65536 Len=0
220,12:09:59.821927330,144.38.239.87,172.64.41.4,TCP,54,51464  >  443 [ACK] Seq=4351 Ack=5988 Win=64128 Len=0
221,12:09:59.822019738,144.38.239.87,172.64.41.4,TCP,54,51464  >  443 [ACK] Seq=4351 Ack=6487 Win=64000 Len=0
222,12:09:59.825942902,144.38.239.87,172.64.41.4,TCP,54,51464  >  443 [ACK] Seq=4351 Ack=6542 Win=64128 Len=0
223,12:09:59.825966729,144.38.239.87,172.64.41.4,TCP,54,51464  >  443 [ACK] Seq=4351 Ack=7041 Win=64000 Len=0
224,12:09:59.825977841,144.38.239.87,172.64.41.4,TCP,54,51464  >  443 [ACK] Seq=4351 Ack=7096 Win=64000 Len=0
225,12:09:59.825986357,144.38.239.87,172.64.41.4,TCP,54,51464  >  443 [ACK] Seq=4351 Ack=7595 Win=63616 Len=0
226,12:09:59.825991497,144.38.239.87,172.64.41.4,TCP,54,51464  >  443 [ACK] Seq=4351 Ack=7650 Win=63616 Len=0
227,12:09:59.826014110,144.38.239.87,172.64.41.4,TCP,54,51464  >  443 [ACK] Seq=4351 Ack=8149 Win=63232 Len=0
228,12:09:59.830222942,34.120.208.123,144.38.239.87,TCP,54,443  >  54588 [ACK] Seq=1 Ack=212 Win=66816 Len=0
229,12:09:59.830223192,34.120.208.123,144.38.239.87,TCP,54,443  >  54598 [ACK] Seq=1 Ack=212 Win=66816 Len=0
230,12:09:59.834165408,144.38.239.87,34.120.208.123,TCP,54,54588  >  443 [ACK] Seq=212 Ack=2601 Win=63616 Len=0
231,12:09:59.834193088,144.38.239.87,34.120.208.123,TCP,54,54588  >  443 [ACK] Seq=212 Ack=3434 Win=62848 Len=0
232,12:09:59.834227166,144.38.239.87,34.120.208.123,TCP,54,54598  >  443 [ACK] Seq=212 Ack=2601 Win=63616 Len=0
233,12:09:59.834235699,144.38.239.87,34.120.208.123,TCP,54,54598  >  443 [ACK] Seq=212 Ack=3434 Win=62848 Len=0
234,12:09:59.838682663,144.38.239.87,34.120.115.102,TCP,54,48394  >  443 [ACK] Seq=1 Ack=1 Win=64256 Len=0
235,12:09:59.839347710,144.38.239.87,34.120.115.102,TCP,54,48384  >  443 [ACK] Seq=1 Ack=1 Win=64256 Len=0
236,12:09:59.846669223,172.64.41.4,144.38.239.87,TCP,54,443  >  51464 [ACK] Seq=8149 Ack=4566 Win=65536 Len=0
237,12:09:59.854806424,34.120.115.102,144.38.239.87,TCP,54,443  >  48394 [ACK] Seq=1 Ack=684 Win=67072 Len=0
238,12:09:59.855228274,144.38.239.87,172.64.41.4,TCP,54,51464  >  443 [ACK] Seq=5426 Ack=9312 Win=64128 Len=0
239,12:09:59.858691114,144.38.239.87,34.120.115.102,TCP,54,48394  >  443 [ACK] Seq=684 Ack=2601 Win=63616 Len=0
240,12:09:59.858705911,144.38.239.87,34.120.115.102,TCP,54,48394  >  443 [ACK] Seq=684 Ack=4557 Win=61696 Len=0
241,12:09:59.858666569,34.120.115.102,144.38.239.87,TCP,54,443  >  48384 [ACK] Seq=1 Ack=684 Win=67072 Len=0
242,12:09:59.862720091,144.38.239.87,34.120.115.102,TCP,54,48384  >  443 [ACK] Seq=684 Ack=2601 Win=63616 Len=0
243,12:09:59.862739059,144.38.239.87,34.120.115.102,TCP,54,48384  >  443 [ACK] Seq=684 Ack=4557 Win=61696 Len=0
244,12:09:59.870454080,144.38.239.87,34.120.208.123,TCP,54,54606  >  443 [ACK] Seq=1 Ack=1 Win=64256 Len=0
245,12:09:59.870503589,144.38.239.87,34.120.208.123,TCP,54,54610  >  443 [ACK] Seq=1 Ack=1 Win=64256 Len=0
246,12:09:59.870393000,172.64.41.4,144.38.239.87,TCP,54,443  >  51464 [ACK] Seq=9811 Ack=5211 Win=65536 Len=0
247,12:09:59.874649449,144.38.239.87,172.64.41.4,TCP,54,51464  >  443 [ACK] Seq=6071 Ack=10919 Win=63104 Len=0
248,12:09:59.882994495,34.120.208.123,144.38.239.87,TCP,54,443  >  54606 [ACK] Seq=1 Ack=212 Win=66816 Len=0
249,12:09:59.882994524,34.120.208.123,144.38.239.87,TCP,54,443  >  54610 [ACK] Seq=1 Ack=212 Win=66816 Len=0
250,12:09:59.883047007,144.38.239.87,34.120.208.123,TCP,54,54606  >  443 [ACK] Seq=212 Ack=2601 Win=63616 Len=0
251,12:09:59.883055232,144.38.239.87,34.120.208.123,TCP,54,54606  >  443 [ACK] Seq=212 Ack=3434 Win=62848 Len=0
252,12:09:59.888177620,144.38.239.87,34.120.208.123,TCP,54,54610  >  443 [ACK] Seq=212 Ack=2601 Win=63616 Len=0
253,12:09:59.888191693,144.38.239.87,34.120.208.123,TCP,54,54610  >  443 [ACK] Seq=212 Ack=3434 Win=62848 Len=0
254,12:09:59.888217127,144.38.239.87,192.229.211.108,TCP,54,38192  >  80 [ACK] Seq=1 Ack=1 Win=64256 Len=0
255,12:09:59.888225471,144.38.239.87,192.229.211.108,TCP,54,38200  >  80 [ACK] Seq=1 Ack=1 Win=64256 Len=0
256,12:09:59.888112354,172.64.41.4,144.38.239.87,TCP,54,443  >  51464 [ACK] Seq=10919 Ack=5641 Win=65536 Len=0
257,12:09:59.888781275,23.44.229.236,144.38.239.87,TCP,54,80  >  53728 [ACK] Seq=1779 Ack=1270 Win=64128 Len=0
258,12:09:59.888781424,23.44.229.236,144.38.239.87,TCP,54,80  >  53700 [ACK] Seq=1778 Ack=1270 Win=64128 Len=0
259,12:09:59.888781464,172.64.41.4,144.38.239.87,TCP,54,443  >  51464 [ACK] Seq=10919 Ack=6071 Win=65536 Len=0
260,12:09:59.890435865,144.38.239.87,23.44.229.236,TCP,54,53700  >  80 [ACK] Seq=1270 Ack=2667 Win=64128 Len=0
261,12:09:59.890764993,144.38.239.87,23.44.229.236,TCP,54,53728  >  80 [ACK] Seq=1270 Ack=2668 Win=64128 Len=0
262,12:09:59.890863366,144.38.239.87,172.64.41.4,TCP,54,51464  >  443 [ACK] Seq=6071 Ack=12581 Win=61696 Len=0
263,12:09:59.905412868,144.38.239.87,34.120.208.123,TCP,54,54612  >  443 [ACK] Seq=1 Ack=1 Win=64256 Len=0
264,12:09:59.905223104,192.229.211.108,144.38.239.87,TCP,54,80  >  38200 [ACK] Seq=1 Ack=425 Win=67072 Len=0
265,12:09:59.905223138,192.229.211.108,144.38.239.87,TCP,54,80  >  38192 [ACK] Seq=1 Ack=425 Win=67072 Len=0
266,12:09:59.905441857,144.38.239.87,192.229.211.108,TCP,54,38192  >  80 [ACK] Seq=425 Ack=738 Win=64128 Len=0
267,12:09:59.905795322,144.38.239.87,192.229.211.108,TCP,54,38200  >  80 [ACK] Seq=425 Ack=738 Win=64128 Len=0
268,12:09:59.906938646,144.38.239.87,34.120.115.102,TCP,54,48394  >  443 [ACK] Seq=935 Ack=5174 Win=64128 Len=0
269,12:09:59.907965205,144.38.239.87,34.120.115.102,TCP,54,"48394  >  443 [FIN, ACK] Seq=959 Ack=5174 Win=64128 Len=0"
270,12:09:59.910132586,172.64.41.4,144.38.239.87,TCP,54,443  >  51464 [ACK] Seq=12581 Ack=6286 Win=65536 Len=0
271,12:09:59.910317523,144.38.239.87,172.64.41.4,TCP,54,51464  >  443 [ACK] Seq=6716 Ack=13135 Win=64128 Len=0
272,12:09:59.915424024,144.38.239.87,172.64.41.4,TCP,54,51464  >  443 [ACK] Seq=6716 Ack=13689 Win=64128 Len=0
273,12:09:59.919317626,34.120.115.102,144.38.239.87,TCP,54,[TCP Previous segment not captured] 443  >  48394 [ACK] Seq=5175 Ack=960 Win=68352 Len=0
274,12:09:59.919317724,34.120.115.102,144.38.239.87,TCP,54,"[TCP Out-Of-Order] 443  >  48394 [FIN, ACK] Seq=5174 Ack=959 Win=68352 Len=0"
275,12:09:59.919368290,144.38.239.87,34.120.115.102,TCP,54,48394  >  443 [ACK] Seq=960 Ack=5175 Win=64128 Len=0
276,12:09:59.919317758,172.64.41.4,144.38.239.87,TCP,54,443  >  51464 [ACK] Seq=13689 Ack=6716 Win=65536 Len=0
277,12:09:59.919317792,34.120.208.123,144.38.239.87,TCP,54,443  >  54612 [ACK] Seq=1 Ack=212 Win=66816 Len=0
278,12:09:59.919528540,144.38.239.87,172.64.41.4,TCP,54,51464  >  443 [ACK] Seq=6716 Ack=14243 Win=64128 Len=0
279,12:09:59.919706244,144.38.239.87,34.120.208.123,TCP,54,54598  >  443 [ACK] Seq=2211 Ack=3836 Win=64128 Len=0
280,12:09:59.919698173,34.120.208.123,144.38.239.87,TCP,54,443  >  54598 [ACK] Seq=3836 Ack=1536 Win=70400 Len=0
281,12:09:59.923485941,144.38.239.87,34.120.208.123,TCP,54,54612  >  443 [ACK] Seq=212 Ack=2601 Win=61696 Len=0
282,12:09:59.923509306,144.38.239.87,34.120.208.123,TCP,54,54612  >  443 [ACK] Seq=212 Ack=3434 Win=60928 Len=0
283,12:09:59.923551816,144.38.239.87,34.120.208.123,TCP,54,54606  >  443 [RST] Seq=499 Win=0 Len=0
284,12:09:59.923425963,34.120.115.102,144.38.239.87,TCP,54,443  >  48384 [ACK] Seq=5398 Ack=1494 Win=69888 Len=0
285,12:09:59.923425999,34.120.208.123,144.38.239.87,TCP,54,"443  >  54606 [FIN, ACK] Seq=3836 Ack=531 Win=67840 Len=0"
286,12:09:59.923580538,144.38.239.87,34.120.208.123,TCP,54,54606  >  443 [RST] Seq=531 Win=0 Len=0
287,12:09:59.927822038,34.120.208.123,144.38.239.87,TCP,54,443  >  54598 [ACK] Seq=3836 Ack=2211 Win=71936 Len=0
288,12:09:59.927879481,144.38.239.87,192.229.211.108,TCP,54,38214  >  80 [ACK] Seq=1 Ack=1 Win=64256 Len=0
289,12:09:59.932524318,144.38.239.87,192.229.211.108,TCP,54,38216  >  80 [ACK] Seq=1 Ack=1 Win=64256 Len=0
290,12:09:59.940752197,144.38.239.87,34.120.208.123,TCP,54,54610  >  443 [RST] Seq=499 Win=0 Len=0
291,12:09:59.941207827,144.38.239.87,34.120.208.123,TCP,54,54588  >  443 [RST] Seq=499 Win=0 Len=0
292,12:09:59.941188955,34.120.208.123,144.38.239.87,TCP,54,"443  >  54610 [FIN, ACK] Seq=3836 Ack=531 Win=67840 Len=0"
293,12:09:59.941224974,144.38.239.87,34.120.208.123,TCP,54,54610  >  443 [RST] Seq=531 Win=0 Len=0
294,12:09:59.941188989,34.120.208.123,144.38.239.87,TCP,54,443  >  54598 [ACK] Seq=3836 Ack=3097 Win=74752 Len=0
295,12:09:59.941189024,34.120.208.123,144.38.239.87,TCP,54,"443  >  54588 [FIN, ACK] Seq=3836 Ack=531 Win=67840 Len=0"
296,12:09:59.941245088,144.38.239.87,34.120.208.123,TCP,54,54588  >  443 [RST] Seq=531 Win=0 Len=0
297,12:09:59.948839564,34.120.208.123,144.38.239.87,TCP,54,443  >  54612 [ACK] Seq=3798 Ack=531 Win=67840 Len=0
298,12:09:59.948922271,144.38.239.87,34.120.208.123,TCP,54,54612  >  443 [RST] Seq=531 Win=0 Len=0
299,12:09:59.948839820,34.120.208.123,144.38.239.87,TCP,54,"443  >  54612 [FIN, ACK] Seq=3836 Ack=531 Win=67840 Len=0"
300,12:09:59.948955370,144.38.239.87,34.120.208.123,TCP,54,54612  >  443 [RST] Seq=531 Win=0 Len=0
301,12:09:59.964542185,144.38.239.87,192.229.211.108,TCP,54,38200  >  80 [ACK] Seq=849 Ack=1475 Win=64128 Len=0
302,12:09:59.964567632,144.38.239.87,192.229.211.108,TCP,54,38192  >  80 [ACK] Seq=849 Ack=1475 Win=64128 Len=0
303,12:09:59.969157130,144.38.239.87,34.120.208.123,TCP,54,54598  >  443 [ACK] Seq=3097 Ack=4550 Win=64128 Len=0
304,12:09:59.983034331,34.120.208.123,144.38.239.87,TCP,54,443  >  54598 [ACK] Seq=4550 Ack=3143 Win=74752 Len=0
305,12:10:00.055255366,172.64.41.4,144.38.239.87,TCP,54,443  >  51464 [ACK] Seq=14243 Ack=6931 Win=65536 Len=0
306,12:10:00.055388129,144.38.239.87,172.64.41.4,TCP,54,51464  >  443 [ACK] Seq=7146 Ack=15374 Win=63104 Len=0
307,12:10:00.067767714,34.120.208.123,144.38.239.87,TCP,54,443  >  54598 [ACK] Seq=5182 Ack=3189 Win=74752 Len=0
308,12:10:00.075819973,172.64.41.4,144.38.239.87,TCP,54,443  >  51464 [ACK] Seq=15374 Ack=7361 Win=65536 Len=0
309,12:10:00.080206346,144.38.239.87,172.64.41.4,TCP,54,51464  >  443 [ACK] Seq=7576 Ack=15928 Win=64128 Len=0
310,12:10:00.080462862,144.38.239.87,172.64.41.4,TCP,54,51464  >  443 [ACK] Seq=7576 Ack=16482 Win=64128 Len=0
311,12:10:00.106819143,144.38.239.87,34.107.243.93,TCP,54,33836  >  443 [ACK] Seq=1 Ack=1 Win=64256 Len=0
312,12:10:00.134192299,34.107.243.93,144.38.239.87,TCP,54,443  >  33836 [ACK] Seq=1 Ack=674 Win=67072 Len=0
313,12:10:00.134236255,144.38.239.87,34.107.243.93,TCP,54,33836  >  443 [ACK] Seq=674 Ack=2601 Win=62336 Len=0
314,12:10:00.134249507,144.38.239.87,34.107.243.93,TCP,54,33836  >  443 [ACK] Seq=674 Ack=4463 Win=60544 Len=0
315,12:10:00.213252607,23.44.229.236,144.38.239.87,TCP,54,80  >  53744 [ACK] Seq=2668 Ack=1693 Win=64128 Len=0
316,12:10:00.213530259,144.38.239.87,172.64.41.4,TCP,54,51464  >  443 [ACK] Seq=8006 Ack=17071 Win=64128 Len=0
317,12:10:00.213551504,144.38.239.87,23.44.229.236,TCP,54,53744  >  80 [ACK] Seq=1693 Ack=3557 Win=64128 Len=0
318,12:10:00.218312619,144.38.239.87,172.64.41.4,TCP,54,51464  >  443 [ACK] Seq=8006 Ack=17625 Win=64128 Len=0
319,12:10:00.227457115,144.38.239.87,34.107.243.93,TCP,54,33836  >  443 [ACK] Seq=908 Ack=5049 Win=64128 Len=0
320,12:10:00.227484675,144.38.239.87,34.107.243.93,TCP,54,33836  >  443 [ACK] Seq=908 Ack=5080 Win=64128 Len=0
321,12:10:00.302857049,144.38.239.87,34.107.243.93,TCP,54,33842  >  443 [ACK] Seq=1 Ack=1 Win=64256 Len=0
322,12:10:00.302802554,34.107.243.93,144.38.239.87,TCP,54,443  >  33836 [ACK] Seq=5080 Ack=939 Win=68352 Len=0
323,12:10:00.318887868,172.64.41.4,144.38.239.87,TCP,54,443  >  51464 [ACK] Seq=17625 Ack=8492 Win=65536 Len=0
324,12:10:00.318888111,34.107.243.93,144.38.239.87,TCP,54,443  >  33842 [ACK] Seq=1 Ack=1231 Win=68096 Len=0
325,12:10:00.319041847,144.38.239.87,172.64.41.4,TCP,54,51464  >  443 [ACK] Seq=8651 Ack=18768 Win=63104 Len=0
326,12:10:00.323764673,144.38.239.87,172.64.41.4,TCP,54,51464  >  443 [ACK] Seq=8651 Ack=19322 Win=64128 Len=0
327,12:10:00.326915615,144.38.239.87,34.107.243.93,TCP,54,33842  >  443 [ACK] Seq=1231 Ack=219 Win=64128 Len=0
328,12:10:00.332350793,34.120.208.123,144.38.239.87,TCP,54,443  >  54598 [ACK] Seq=5182 Ack=3471 Win=76288 Len=0
329,12:10:00.332350925,34.120.208.123,144.38.239.87,TCP,54,443  >  54598 [ACK] Seq=5182 Ack=4610 Win=78592 Len=0
330,12:10:00.332403051,144.38.239.87,34.120.208.123,TCP,54,54624  >  443 [ACK] Seq=1 Ack=1 Win=64256 Len=0
331,12:10:00.339625822,34.107.243.93,144.38.239.87,TCP,54,443  >  33842 [ACK] Seq=219 Ack=1919 Win=70656 Len=0
332,12:10:00.344410995,34.120.208.123,144.38.239.87,TCP,54,443  >  54624 [ACK] Seq=1 Ack=679 Win=67072 Len=0
333,12:10:00.348124654,144.38.239.87,34.120.208.123,TCP,54,54624  >  443 [ACK] Seq=679 Ack=2601 Win=63360 Len=0
334,12:10:00.348138947,144.38.239.87,34.120.208.123,TCP,54,54624  >  443 [ACK] Seq=679 Ack=3513 Win=62464 Len=0
335,12:10:00.383891640,144.38.239.87,34.120.208.123,TCP,54,54624  >  443 [ACK] Seq=930 Ack=4130 Win=64128 Len=0
336,12:10:00.384022242,144.38.239.87,34.120.208.123,TCP,54,"54624  >  443 [FIN, ACK] Seq=954 Ack=4130 Win=64128 Len=0"
337,12:10:00.420538574,144.38.239.87,34.120.208.123,TCP,54,"[TCP Retransmission] 54624  >  443 [FIN, ACK] Seq=954 Ack=4130 Win=64128 Len=0"
338,12:10:00.425011182,34.120.208.123,144.38.239.87,TCP,54,"443  >  54624 [FIN, ACK] Seq=4130 Ack=955 Win=68352 Len=0"
339,12:10:00.425053154,144.38.239.87,34.120.208.123,TCP,54,54624  >  443 [ACK] Seq=955 Ack=4131 Win=64128 Len=0
340,12:10:00.425011577,34.107.243.93,144.38.239.87,TCP,54,443  >  33842 [ACK] Seq=1017 Ack=2102 Win=72960 Len=0
341,12:10:00.426373894,144.38.239.87,34.120.208.123,TCP,54,54598  >  443 [ACK] Seq=4610 Ack=5546 Win=64128 Len=0
342,12:10:00.437056435,34.120.208.123,144.38.239.87,TCP,54,443  >  54598 [ACK] Seq=5546 Ack=4656 Win=78592 Len=0
343,12:10:00.448912051,34.120.208.123,144.38.239.87,TCP,54,443  >  54598 [ACK] Seq=5546 Ack=4786 Win=80896 Len=0
344,12:10:00.448912350,34.120.208.123,144.38.239.87,TCP,54,443  >  54598 [ACK] Seq=5546 Ack=6013 Win=83456 Len=0
345,12:10:00.459312706,172.64.41.4,144.38.239.87,TCP,54,443  >  51464 [ACK] Seq=19322 Ack=8866 Win=65536 Len=0
346,12:10:00.463623711,144.38.239.87,172.64.41.4,TCP,54,51464  >  443 [ACK] Seq=9296 Ack=20430 Win=63104 Len=0
347,12:10:00.468245920,144.38.239.87,172.64.41.4,TCP,54,51464  >  443 [ACK] Seq=9296 Ack=20984 Win=64128 Len=0
348,12:10:00.720075938,172.64.41.4,144.38.239.87,TCP,54,443  >  51464 [ACK] Seq=20984 Ack=9511 Win=65536 Len=0
349,12:10:00.720076113,34.120.208.123,144.38.239.87,TCP,54,443  >  54598 [ACK] Seq=5874 Ack=6059 Win=83456 Len=0
350,12:10:00.720314131,144.38.239.87,172.64.41.4,TCP,54,51464  >  443 [ACK] Seq=11231 Ack=21538 Win=64128 Len=0
351,12:10:00.720571866,144.38.239.87,172.64.41.4,TCP,54,51464  >  443 [ACK] Seq=11231 Ack=23200 Win=62592 Len=0
352,12:10:00.724609009,34.120.208.123,144.38.239.87,TCP,54,443  >  54598 [ACK] Seq=5874 Ack=6190 Win=85760 Len=0
353,12:10:00.724609254,34.120.208.123,144.38.239.87,TCP,54,443  >  54598 [ACK] Seq=5874 Ack=6712 Win=88320 Len=0
354,12:10:00.724693561,144.38.239.87,172.64.41.4,TCP,54,51464  >  443 [ACK] Seq=11231 Ack=24308 Win=62464 Len=0
355,12:10:00.732409991,172.64.41.4,144.38.239.87,TCP,54,443  >  51464 [ACK] Seq=24308 Ack=10801 Win=65536 Len=0
356,12:10:00.732732639,144.38.239.87,172.64.41.4,TCP,54,51464  >  443 [ACK] Seq=11231 Ack=24862 Win=64128 Len=0
357,12:10:00.736929428,144.38.239.87,172.64.41.4,TCP,54,51464  >  443 [ACK] Seq=11231 Ack=25970 Win=63104 Len=0
358,12:10:00.748516317,144.38.239.87,34.107.243.93,TCP,54,33842  >  443 [ACK] Seq=2102 Ack=1154 Win=64128 Len=0
359,12:10:00.763048649,34.120.115.102,144.38.239.87,TCP,54,443  >  48384 [ACK] Seq=5398 Ack=1706 Win=69888 Len=0
360,12:10:00.781058242,34.120.115.102,144.38.239.87,TCP,54,443  >  48384 [ACK] Seq=5549 Ack=1745 Win=69888 Len=0
361,12:10:00.797752553,34.120.237.76,144.38.239.87,TCP,54,443  >  47814 [ACK] Seq=5723 Ack=2774 Win=76544 Len=0
